{
  "$schema": "https://json-schema.org/draft/2020-12/schema",
  "$id": "https://schemas.esquilospeak.com/content/unit.schema.json",
  "title": "Course unit",
  "type": "object",
  "required": [
    "id",
    "courseId",
    "courseVersion",
    "position",
    "title",
    "outcomeIds",
    "prerequisiteUnitIds",
    "lessonIds"
  ],
  "properties": {
    "id": { "$ref": "common.schema.json#/$defs/identifier" },
    "courseId": { "$ref": "common.schema.json#/$defs/identifier" },
    "courseVersion": { "type": "integer", "minimum": 1 },
    "position": { "type": "integer", "minimum": 1 },
    "title": { "$ref": "common.schema.json#/$defs/localizedText" },
    "outcomeIds": {
      "type": "array",
      "items": { "$ref": "common.schema.json#/$defs/identifier" },
      "minItems": 1,
      "uniqueItems": true
    },
    "prerequisiteUnitIds": {
      "type": "array",
      "items": { "$ref": "common.schema.json#/$defs/identifier" },
      "uniqueItems": true
    },
    "lessonIds": {
      "type": "array",
      "items": { "$ref": "common.schema.json#/$defs/identifier" },
      "minItems": 1,
      "uniqueItems": true
    },
    "guidebook": {
      "type": "object",
      "required": ["summary", "keyPhrases", "grammarNotes", "examples"],
      "properties": {
        "summary": { "$ref": "common.schema.json#/$defs/localizedText" },
        "keyPhrases": { "type": "array", "minItems": 2, "items": { "$ref": "common.schema.json#/$defs/localizedText" } },
        "grammarNotes": { "type": "array", "minItems": 1, "items": { "$ref": "common.schema.json#/$defs/localizedText" } },
        "examples": { "type": "array", "minItems": 2, "items": { "$ref": "common.schema.json#/$defs/localizedText" } }
      },
      "additionalProperties": false
    }
  },
  "additionalProperties": false
}
